,FILEID,FILETYPE,STUSAB,CHARITER,SEQUENCE,LOGRECNO,,,,UNWEIGHTED GROUP QUARTERS POPULATION SAMPLE% Final actual interviews,,HOUSING UNIT COVERAGE RATE for Housing Units,TOTAL POPULATION COVERAGE RATE BY SEX for Total Population,TOTAL POPULATION COVERAGE RATE BY SEX% Male,TOTAL POPULATION COVERAGE RATE BY SEX% Female,TOTAL POPULATION COVERAGE RATE BY WEIGHTING RACE AND HISPANIC OR LATINO GROUPS for Total Population,TOTAL POPULATION COVERAGE RATE BY WEIGHTING RACE AND HISPANIC OR LATINO GROUPS% Not Hispanic or Latino:% White,TOTAL POPULATION COVERAGE RATE BY WEIGHTING RACE AND HISPANIC OR LATINO GROUPS% Not Hispanic or Latino:% Black or African American,TOTAL POPULATION COVERAGE RATE BY WEIGHTING RACE AND HISPANIC OR LATINO GROUPS% Not Hispanic or Latino:% American Indian and Alaska Native,TOTAL POPULATION COVERAGE RATE BY WEIGHTING RACE AND HISPANIC OR LATINO GROUPS% Not Hispanic or Latino:% Asian,TOTAL POPULATION COVERAGE RATE BY WEIGHTING RACE AND HISPANIC OR LATINO GROUPS% Not Hispanic or Latino:% Native Hawaiian and Other Pacific Islander,TOTAL POPULATION COVERAGE RATE BY WEIGHTING RACE AND HISPANIC OR LATINO GROUPS% Hispanic or Latino,GROUP QUARTERS POPULATION COVERAGE RATE for Population in Group Quarters,HOUSING UNIT RESPONSE AND NONRESPONSE RATES WITH REASONS FOR NONINTERVIEWS% Response Rate,HOUSING UNIT RESPONSE AND NONRESPONSE RATES WITH REASONS FOR NONINTERVIEWS% Nonresponse Rate:,HOUSING UNIT RESPONSE AND NONRESPONSE RATES WITH REASONS FOR NONINTERVIEWS% Nonresponse Rate:% Refusal,HOUSING UNIT RESPONSE AND NONRESPONSE RATES WITH REASONS FOR NONINTERVIEWS% Nonresponse Rate:% Unable To Locate,HOUSING UNIT RESPONSE AND NONRESPONSE RATES WITH REASONS FOR NONINTERVIEWS% Nonresponse Rate:% No One Home,HOUSING UNIT RESPONSE AND NONRESPONSE RATES WITH REASONS FOR NONINTERVIEWS% Nonresponse Rate:% Temporarily Absent,HOUSING UNIT RESPONSE AND NONRESPONSE RATES WITH REASONS FOR NONINTERVIEWS% Nonresponse Rate:% Language Problem,HOUSING UNIT RESPONSE AND NONRESPONSE RATES WITH REASONS FOR NONINTERVIEWS% Nonresponse Rate:% Insufficient Data,HOUSING UNIT RESPONSE AND NONRESPONSE RATES WITH REASONS FOR NONINTERVIEWS% Nonresponse Rate:% Other Reason,GROUP QUARTERS POPULATION RESPONSE AND NONRESPONSE RATES WITH REASONS FOR NONINTERVIEWS% Response Rate,GROUP QUARTERS POPULATION RESPONSE AND NONRESPONSE RATES WITH REASONS FOR NONINTERVIEWS% Nonresponse Rate:,GROUP QUARTERS POPULATION RESPONSE AND NONRESPONSE RATES WITH REASONS FOR NONINTERVIEWS% Nonresponse Rate:% Group Quarters Person Refusal,GROUP QUARTERS POPULATION RESPONSE AND NONRESPONSE RATES WITH REASONS FOR NONINTERVIEWS% Nonresponse Rate:% Unable To Locate Group Quarters Person,GROUP QUARTERS POPULATION RESPONSE AND NONRESPONSE RATES WITH REASONS FOR NONINTERVIEWS% Nonresponse Rate:% Resident Temporarily Absent,GROUP QUARTERS POPULATION RESPONSE AND NONRESPONSE RATES WITH REASONS FOR NONINTERVIEWS% Nonresponse Rate:% Language Problem,GROUP QUARTERS POPULATION RESPONSE AND NONRESPONSE RATES WITH REASONS FOR NONINTERVIEWS% Nonresponse Rate:% Insufficient Data,GROUP QUARTERS POPULATION RESPONSE AND NONRESPONSE RATES WITH REASONS FOR NONINTERVIEWS% Nonresponse Rate:% Group Quarters Person Other Reason,GROUP QUARTERS POPULATION RESPONSE AND NONRESPONSE RATES WITH REASONS FOR NONINTERVIEWS% Nonresponse Rate:% Whole Group Quarters Refusal,GROUP QUARTERS POPULATION RESPONSE AND NONRESPONSE RATES WITH REASONS FOR NONINTERVIEWS% Nonresponse Rate:% Whole Group Quarters Other Reason,OVERALL PERSON CHARACTERISTIC IMPUTATION RATE for Total Population,OVERALL HOUSING UNIT CHARACTERISTIC IMPUTATION RATE for Total Population,Geographic Identifier,Area Name
0,ACSSF,20140.0,dc,0,161,2,,,,,,,,,,,,,,,,,,,,,,,,,,,,,,,,,,,,,,,04001US11,District of Columbia -- Urban
1,ACSSF,20140.0,dc,0,161,3,,,,,,,,,,,,,,,,,,,,,,,,,,,,,,,,,,,,,,,040A0US11,District of Columbia -- In metropolitan or micropolitan statistical area
2,ACSSF,20140.0,dc,0,161,4,,,,,,,,,,,,,,,,,,,,,,,,,,,,,,,,,,,,,,,040C0US11,District of Columbia -- In metropolitan statistical area
3,ACSSF,20140.0,dc,0,161,5,,,,,,,,,,,,,,,,,,,,,,,,,,,,,,,,,,,,,,,040C1US11,District of Columbia -- In metropolitan statistical area -- in principal city
4,ACSSF,20140.0,dc,0,161,6,7307.0,4693.0,,,,,,,,,,,,,,,,93.4,6.6,2.5,0.1,1.1,0.1,0.1,0.4,2.4,,,,,,,,,,,,,05000US11001,"District of Columbia, District of Columbia"
5,ACSSF,20140.0,dc,0,161,7,,,,,,,,,,,,,,,,,,,,,,,,,,,,,,,,,,,,,,,16000US1150000,"Washington city, District of Columbia"
6,ACSSF,20140.0,dc,0,161,8,,,,,,,,,,,,,,,,,,,,,,,,,,,,,,,,,,,,,,,31200US479001150000,"Washington city, DC; Washington-Arlington-Alexandria, DC-VA-MD-WV Metro Area"
7,ACSSF,20140.0,dc,0,161,9,,,,,,,,,,,,,,,,,,,,,,,,,,,,,,,,,,,,,,,50000US1198,"Delegate District (at Large) (114th Congress), District of Columbia"
8,ACSSF,20140.0,dc,0,161,10,,,,,,,,,,,,,,,,,,,,,,,,,,,,,,,,,,,,,,,79500US1100101,"District of Columbia (West) PUMA, District of Columbia"
9,ACSSF,20140.0,dc,0,161,11,,,,,,,,,,,,,,,,,,,,,,,,,,,,,,,,,,,,,,,79500US1100102,"District of Columbia (North) PUMA, District of Columbia"
10,ACSSF,20140.0,dc,0,161,12,,,,,,,,,,,,,,,,,,,,,,,,,,,,,,,,,,,,,,,79500US1100103,"District of Columbia (Northeast) PUMA, District of Columbia"
11,ACSSF,20140.0,dc,0,161,13,,,,,,,,,,,,,,,,,,,,,,,,,,,,,,,,,,,,,,,79500US1100104,"District of Columbia (East) PUMA, District of Columbia"
12,ACSSF,20140.0,dc,0,161,14,,,,,,,,,,,,,,,,,,,,,,,,,,,,,,,,,,,,,,,79500US1100105,"District of Columbia (Central) PUMA, District of Columbia"
13,ACSSF,20140.0,dc,0,161,15,,,,,,,,,,,,,,,,,,,,,,,,,,,,,,,,,,,,,,,97000US1100030,"District of Columbia Public Schools, District of Columbia"
