,FILEID,FILETYPE,STUSAB,CHARITER,SEQUENCE,LOGRECNO,"DETAILED OCCUPATION BY MEDIAN EARNINGS IN THE PAST 12 MONTHS (IN 2014 INFLATION-ADJUSTED DOLLARS) for FULL-TIME, YEAR-ROUND CIVILIAN EMPLOYED POPULATION 16 YEARS AND OVER%Supervisors of transportation and material moving workers","DETAILED OCCUPATION BY MEDIAN EARNINGS IN THE PAST 12 MONTHS (IN 2014 INFLATION-ADJUSTED DOLLARS) for FULL-TIME, YEAR-ROUND CIVILIAN EMPLOYED POPULATION 16 YEARS AND OVER%Aircraft pilots and flight engineers","DETAILED OCCUPATION BY MEDIAN EARNINGS IN THE PAST 12 MONTHS (IN 2014 INFLATION-ADJUSTED DOLLARS) for FULL-TIME, YEAR-ROUND CIVILIAN EMPLOYED POPULATION 16 YEARS AND OVER%Air traffic controllers and airfield operations specialists","DETAILED OCCUPATION BY MEDIAN EARNINGS IN THE PAST 12 MONTHS (IN 2014 INFLATION-ADJUSTED DOLLARS) for FULL-TIME, YEAR-ROUND CIVILIAN EMPLOYED POPULATION 16 YEARS AND OVER%Flight attendants","DETAILED OCCUPATION BY MEDIAN EARNINGS IN THE PAST 12 MONTHS (IN 2014 INFLATION-ADJUSTED DOLLARS) for FULL-TIME, YEAR-ROUND CIVILIAN EMPLOYED POPULATION 16 YEARS AND OVER%Ambulance drivers and attendants, except emergency medical technicians","DETAILED OCCUPATION BY MEDIAN EARNINGS IN THE PAST 12 MONTHS (IN 2014 INFLATION-ADJUSTED DOLLARS) for FULL-TIME, YEAR-ROUND CIVILIAN EMPLOYED POPULATION 16 YEARS AND OVER%Bus drivers","DETAILED OCCUPATION BY MEDIAN EARNINGS IN THE PAST 12 MONTHS (IN 2014 INFLATION-ADJUSTED DOLLARS) for FULL-TIME, YEAR-ROUND CIVILIAN EMPLOYED POPULATION 16 YEARS AND OVER%Driver/sales workers and truck drivers","DETAILED OCCUPATION BY MEDIAN EARNINGS IN THE PAST 12 MONTHS (IN 2014 INFLATION-ADJUSTED DOLLARS) for FULL-TIME, YEAR-ROUND CIVILIAN EMPLOYED POPULATION 16 YEARS AND OVER%Taxi drivers and chauffeurs","DETAILED OCCUPATION BY MEDIAN EARNINGS IN THE PAST 12 MONTHS (IN 2014 INFLATION-ADJUSTED DOLLARS) for FULL-TIME, YEAR-ROUND CIVILIAN EMPLOYED POPULATION 16 YEARS AND OVER%Motor vehicle operators, all other","DETAILED OCCUPATION BY MEDIAN EARNINGS IN THE PAST 12 MONTHS (IN 2014 INFLATION-ADJUSTED DOLLARS) for FULL-TIME, YEAR-ROUND CIVILIAN EMPLOYED POPULATION 16 YEARS AND OVER%Locomotive engineers and operators","DETAILED OCCUPATION BY MEDIAN EARNINGS IN THE PAST 12 MONTHS (IN 2014 INFLATION-ADJUSTED DOLLARS) for FULL-TIME, YEAR-ROUND CIVILIAN EMPLOYED POPULATION 16 YEARS AND OVER%Railroad brake, signal, and switch operators","DETAILED OCCUPATION BY MEDIAN EARNINGS IN THE PAST 12 MONTHS (IN 2014 INFLATION-ADJUSTED DOLLARS) for FULL-TIME, YEAR-ROUND CIVILIAN EMPLOYED POPULATION 16 YEARS AND OVER%Railroad conductors and yardmasters","DETAILED OCCUPATION BY MEDIAN EARNINGS IN THE PAST 12 MONTHS (IN 2014 INFLATION-ADJUSTED DOLLARS) for FULL-TIME, YEAR-ROUND CIVILIAN EMPLOYED POPULATION 16 YEARS AND OVER%Subway, streetcar, and other rail transportation workers","DETAILED OCCUPATION BY MEDIAN EARNINGS IN THE PAST 12 MONTHS (IN 2014 INFLATION-ADJUSTED DOLLARS) for FULL-TIME, YEAR-ROUND CIVILIAN EMPLOYED POPULATION 16 YEARS AND OVER%Sailors and marine oilers","DETAILED OCCUPATION BY MEDIAN EARNINGS IN THE PAST 12 MONTHS (IN 2014 INFLATION-ADJUSTED DOLLARS) for FULL-TIME, YEAR-ROUND CIVILIAN EMPLOYED POPULATION 16 YEARS AND OVER%Ship and boat captains and operators","DETAILED OCCUPATION BY MEDIAN EARNINGS IN THE PAST 12 MONTHS (IN 2014 INFLATION-ADJUSTED DOLLARS) for FULL-TIME, YEAR-ROUND CIVILIAN EMPLOYED POPULATION 16 YEARS AND OVER%Ship engineers","DETAILED OCCUPATION BY MEDIAN EARNINGS IN THE PAST 12 MONTHS (IN 2014 INFLATION-ADJUSTED DOLLARS) for FULL-TIME, YEAR-ROUND CIVILIAN EMPLOYED POPULATION 16 YEARS AND OVER%Bridge and lock tenders","DETAILED OCCUPATION BY MEDIAN EARNINGS IN THE PAST 12 MONTHS (IN 2014 INFLATION-ADJUSTED DOLLARS) for FULL-TIME, YEAR-ROUND CIVILIAN EMPLOYED POPULATION 16 YEARS AND OVER%Parking lot attendants","DETAILED OCCUPATION BY MEDIAN EARNINGS IN THE PAST 12 MONTHS (IN 2014 INFLATION-ADJUSTED DOLLARS) for FULL-TIME, YEAR-ROUND CIVILIAN EMPLOYED POPULATION 16 YEARS AND OVER%Automotive and watercraft service attendants","DETAILED OCCUPATION BY MEDIAN EARNINGS IN THE PAST 12 MONTHS (IN 2014 INFLATION-ADJUSTED DOLLARS) for FULL-TIME, YEAR-ROUND CIVILIAN EMPLOYED POPULATION 16 YEARS AND OVER%Transportation inspectors","DETAILED OCCUPATION BY MEDIAN EARNINGS IN THE PAST 12 MONTHS (IN 2014 INFLATION-ADJUSTED DOLLARS) for FULL-TIME, YEAR-ROUND CIVILIAN EMPLOYED POPULATION 16 YEARS AND OVER%Transportation attendants, except flight attendants","DETAILED OCCUPATION BY MEDIAN EARNINGS IN THE PAST 12 MONTHS (IN 2014 INFLATION-ADJUSTED DOLLARS) for FULL-TIME, YEAR-ROUND CIVILIAN EMPLOYED POPULATION 16 YEARS AND OVER%Other transportation workers","DETAILED OCCUPATION BY MEDIAN EARNINGS IN THE PAST 12 MONTHS (IN 2014 INFLATION-ADJUSTED DOLLARS) for FULL-TIME, YEAR-ROUND CIVILIAN EMPLOYED POPULATION 16 YEARS AND OVER%Conveyor operators and tenders","DETAILED OCCUPATION BY MEDIAN EARNINGS IN THE PAST 12 MONTHS (IN 2014 INFLATION-ADJUSTED DOLLARS) for FULL-TIME, YEAR-ROUND CIVILIAN EMPLOYED POPULATION 16 YEARS AND OVER%Crane and tower operators","DETAILED OCCUPATION BY MEDIAN EARNINGS IN THE PAST 12 MONTHS (IN 2014 INFLATION-ADJUSTED DOLLARS) for FULL-TIME, YEAR-ROUND CIVILIAN EMPLOYED POPULATION 16 YEARS AND OVER%Dredge, excavating, and loading machine operators","DETAILED OCCUPATION BY MEDIAN EARNINGS IN THE PAST 12 MONTHS (IN 2014 INFLATION-ADJUSTED DOLLARS) for FULL-TIME, YEAR-ROUND CIVILIAN EMPLOYED POPULATION 16 YEARS AND OVER%Hoist and winch operators","DETAILED OCCUPATION BY MEDIAN EARNINGS IN THE PAST 12 MONTHS (IN 2014 INFLATION-ADJUSTED DOLLARS) for FULL-TIME, YEAR-ROUND CIVILIAN EMPLOYED POPULATION 16 YEARS AND OVER%Industrial truck and tractor operators","DETAILED OCCUPATION BY MEDIAN EARNINGS IN THE PAST 12 MONTHS (IN 2014 INFLATION-ADJUSTED DOLLARS) for FULL-TIME, YEAR-ROUND CIVILIAN EMPLOYED POPULATION 16 YEARS AND OVER%Cleaners of vehicles and equipment","DETAILED OCCUPATION BY MEDIAN EARNINGS IN THE PAST 12 MONTHS (IN 2014 INFLATION-ADJUSTED DOLLARS) for FULL-TIME, YEAR-ROUND CIVILIAN EMPLOYED POPULATION 16 YEARS AND OVER%Laborers and freight, stock, and material movers, hand","DETAILED OCCUPATION BY MEDIAN EARNINGS IN THE PAST 12 MONTHS (IN 2014 INFLATION-ADJUSTED DOLLARS) for FULL-TIME, YEAR-ROUND CIVILIAN EMPLOYED POPULATION 16 YEARS AND OVER%Machine feeders and offbearers","DETAILED OCCUPATION BY MEDIAN EARNINGS IN THE PAST 12 MONTHS (IN 2014 INFLATION-ADJUSTED DOLLARS) for FULL-TIME, YEAR-ROUND CIVILIAN EMPLOYED POPULATION 16 YEARS AND OVER%Packers and packagers, hand","DETAILED OCCUPATION BY MEDIAN EARNINGS IN THE PAST 12 MONTHS (IN 2014 INFLATION-ADJUSTED DOLLARS) for FULL-TIME, YEAR-ROUND CIVILIAN EMPLOYED POPULATION 16 YEARS AND OVER%Pumping station operators","DETAILED OCCUPATION BY MEDIAN EARNINGS IN THE PAST 12 MONTHS (IN 2014 INFLATION-ADJUSTED DOLLARS) for FULL-TIME, YEAR-ROUND CIVILIAN EMPLOYED POPULATION 16 YEARS AND OVER%Refuse and recyclable material collectors","DETAILED OCCUPATION BY MEDIAN EARNINGS IN THE PAST 12 MONTHS (IN 2014 INFLATION-ADJUSTED DOLLARS) for FULL-TIME, YEAR-ROUND CIVILIAN EMPLOYED POPULATION 16 YEARS AND OVER%Mine shuttle car operators","DETAILED OCCUPATION BY MEDIAN EARNINGS IN THE PAST 12 MONTHS (IN 2014 INFLATION-ADJUSTED DOLLARS) for FULL-TIME, YEAR-ROUND CIVILIAN EMPLOYED POPULATION 16 YEARS AND OVER%Tank car, truck, and ship loaders","DETAILED OCCUPATION BY MEDIAN EARNINGS IN THE PAST 12 MONTHS (IN 2014 INFLATION-ADJUSTED DOLLARS) for FULL-TIME, YEAR-ROUND CIVILIAN EMPLOYED POPULATION 16 YEARS AND OVER%Material moving workers, all other",Geographic Identifier,Area Name
0,ACSSF,20140.0,dc,0,122,2,,,,,,,,,,,,,,,,,,,,,,,,,,,,,,,,,,,,,04001US11,District of Columbia -- Urban
1,ACSSF,20140.0,dc,0,122,3,,,,,,,,,,,,,,,,,,,,,,,,,,,,,,,,,,,,,040A0US11,District of Columbia -- In metropolitan or micropolitan statistical area
2,ACSSF,20140.0,dc,0,122,4,,,,,,,,,,,,,,,,,,,,,,,,,,,,,,,,,,,,,040C0US11,District of Columbia -- In metropolitan statistical area
3,ACSSF,20140.0,dc,0,122,5,,,,,,,,,,,,,,,,,,,,,,,,,,,,,,,,,,,,,040C1US11,District of Columbia -- In metropolitan statistical area -- in principal city
4,ACSSF,20140.0,dc,0,122,6,,,,,,,,,,,,,,,,,,,,,,,,,,,,,,,,,,,,,05000US11001,"District of Columbia, District of Columbia"
5,ACSSF,20140.0,dc,0,122,7,,,,,,,,,,,,,,,,,,,,,,,,,,,,,,,,,,,,,16000US1150000,"Washington city, District of Columbia"
6,ACSSF,20140.0,dc,0,122,8,,,,,,,,,,,,,,,,,,,,,,,,,,,,,,,,,,,,,31200US479001150000,"Washington city, DC; Washington-Arlington-Alexandria, DC-VA-MD-WV Metro Area"
7,ACSSF,20140.0,dc,0,122,9,,,,,,,,,,,,,,,,,,,,,,,,,,,,,,,,,,,,,50000US1198,"Delegate District (at Large) (114th Congress), District of Columbia"
8,ACSSF,20140.0,dc,0,122,10,,,,,,,,,,,,,,,,,,,,,,,,,,,,,,,,,,,,,79500US1100101,"District of Columbia (West) PUMA, District of Columbia"
9,ACSSF,20140.0,dc,0,122,11,,,,,,,,,,,,,,,,,,,,,,,,,,,,,,,,,,,,,79500US1100102,"District of Columbia (North) PUMA, District of Columbia"
10,ACSSF,20140.0,dc,0,122,12,,,,,,,,,,,,,,,,,,,,,,,,,,,,,,,,,,,,,79500US1100103,"District of Columbia (Northeast) PUMA, District of Columbia"
11,ACSSF,20140.0,dc,0,122,13,,,,,,,,,,,,,,,,,,,,,,,,,,,,,,,,,,,,,79500US1100104,"District of Columbia (East) PUMA, District of Columbia"
12,ACSSF,20140.0,dc,0,122,14,,,,,,,,,,,,,,,,,,,,,,,,,,,,,,,,,,,,,79500US1100105,"District of Columbia (Central) PUMA, District of Columbia"
13,ACSSF,20140.0,dc,0,122,15,,,,,,,,,,,,,,,,,,,,,,,,,,,,,,,,,,,,,97000US1100030,"District of Columbia Public Schools, District of Columbia"
